Question,Answer,Options
What does a red light mean?,Stop,"Go,Get Ready"
What does a yellow light mean?,Slow down,"Speed up,Stop"
What does a green light mean?,Go,"Stop,Turn right"
What should you do at a stop sign?,Come to a complete stop,"Slow down,Turn right"
What is the purpose of a crosswalk?,To allow pedestrians to safely cross the road,"To park your vehicle,To stop other vehicles"
How should you react when you see an emergency vehicle with its lights and sirens on?,Pull over to the right and stop,"Follow closely,Speed up"